<?xml version="1.0"?>
<?xml-stylesheet type="text/css" href="books.css"?>
<book-info xmlns="http://my_namespace" xmlns:xsi="http://www.w3.org/2001/xmlschema-instance" xsi:schemaLocation="http://my_namespace
e:\surekha\books.xsd">
<books>
<titleofthebook>web programming</titleofthebook>
<Authorname>chris bates</Authorname>
<ISBNnumber>123-333</ISBNnumber>
<publication>willy</publication>
<edition>2nd</edition>
<price>435</price>
</books>
<books>
<titleofthebook>compiler design</titleofthebook>
<Authorname>ulmon</Authorname>
<ISBNnumber>1223-333</ISBNnumber>
<publication>pearson</publication>
<edition>2nd</edition>
<price>475</price>
</books>
</book-info>